title,text,true_label
Black Like He And I: The Man-Not And The Fight To Humanize Black Men And Boys,"The boogie man is real. He is not a monster with long fangs, sharp claws, red eyes, and a tail who lives in your closet and comes out when the bedroom light is off. He is, in fact, a man of different ages, height, weight, and skin complexion. He is the Black man. Throughout our time in America, the Black man has been demonized as this being who is a destructive, carnivorous, raping, and murderous beast who is a danger to every human on this planet. This belief has been the motivation for many acts of violence towards the Black man: beatings, stabbings, lynching, as well as legislation such as the Black Codes and the 1994 Crime Bill. The thought of the African-American man being an out-of-control criminal and sexual predator has marred him in society by white men, white women, and even his own community. Dr. Tommy J. Curry, professor of philosophy at Texas A&amp;M University, hopes to fight the perception of the Black boogie man with his new book, The Man-Not: Race, Class, Genre, and the Dilemma of Black Manhood. The Man-Not was written to show the Black man as something other than a caricature of violence: as a full-bodied person. Can people who have been studied and labeled as irredeemable and misogynist by white and Black feminist groups be viewed as men who are capable of vulnerability? Can a being that has not only historically been the target of violent racist attacks by white men and women be victims of sexual violence from said people as well? I became aware of Dr. Curry by listening to an interview he gave on the podcast, “The Context of White Supremacy”, a show dedicated to discussing racism with other non-white people. What struck me was not how well researched Curry’s theories on white supremacy were. Although his thoughts were grounded in facts, I was taken aback by how fearless he was in addressing racism, not only to the academia or “academy” as he likes to call it, but in everyday life. Dr. Curry’s explanation of how white people cannot be ignorant about racism was mind altering. Instead of blaming it on no contact or lack of socialization, Curry pushes back and lays the responsibility on white culture itself, “We know that white people have done the same type of behaviors. They have discriminated against Black people; they’ve called Black people niggers and God knows what other names. They always vitiated, secluded, and segregated Blackness. To repeat those things doesn’t seem to be the work of ignorance, in fact, it seems to be the repetition of historical knowledge of about how to treat Black folk. So when we see the same thing, ignorance seems to be the unrealistic apologetic.” To this day it is the most valuable theory on race that I have heard in the past five years. The main part of The Man-Not is broken down into five chapters. In “On Mimesis and Men”, Dr. Curry reveals the justification of enslaving and controlling the Black man and the origin of the “Black Beast” narrative. In “Lost In a Kiss?”, Dr. Curry discusses Eldridge Cleaver’s lost manuscript The Book of Lives, Cleaver’s thoughts on the sexualization of Black men in prison, and how the mere existence of Black life provokes an attack by white racists. “The Political Economy of Niggerdom” is a look into the negative perception of Black men held by many in the academy and other PWI’s (Predominately White Institutions). Dr. Curry highlights that many of the current theories being taught in colleges about African-American males are inaccurate and based on racist thought. “Eschatological Dilemmas” talks about the often victimized Black male through sexualized violence, and why they are not afforded the ability to be seen as victims. Finally, “In the Fiat of Dreams” illustrates how not only the death of Black men and boys is de-centered, but it is thought of as deserving. Each chapter in The Man-Not presents a case of the African-American men and boys being in constant danger for existing. On the state of the Black man, Dr. Curry comments, “To be a Black male is to live in constant fear of being accused of some offense against another. Black men live in a world where any accusation against them is thought to be evidence of their guilt. Imagine a world in which any individual who can be thought of as a victim of a Black male has the power to define him as a criminal. This is the world many Black males find themselves imprisoned within, too often defined by the accusations of others against them rather than their actual character.” This is a part of the everyday existence of being Black. Your word means very little. If someone accuses you of a crime, the thought is that you are guilty of said crime. If you look like a criminal, chances are you are one. I thought about Michael Bennett, the Seattle Seahawks football player who was held at gunpoint by police for “looking like a suspect.” The benefit of the doubt is never given to us. I was very interested in reading “Lost In a Kiss?”, the section of the book that highlights Cleaver’s lost manuscript, The Book of Lives. I had read Cleaver’s raw Soul on Ice when I was young and had been fascinated by his view on white supremacy. It wasn’t the bourgeois look into racism that many of his contemporaries had, but a gritty, gutter, street-level take on racist whites and the system they preside over. The Book of Lives, an unpublished writing of Cleaver’s, spoke about homosexuality in prison and how, in Dr. Curry’s words, “prisons are hedonistic warehouses.” This ties into the theme of The Man-Not: the specific societal and historic vulnerability of Black men and the white supremacist order, making the Black male disposable. “Lost in a Kiss?” also talks about the irrational fear that whites possess towards Black people and the violence that Blackness attracts. Dr. Curry quotes Frantz Fanon, author of the classic book The Wretched of The Earth on this issue: “The Negro is phobogenic, meaning that the Negro triggers a pre-rational fear in the mind of the white. This fear objectifies the Negro, over-determining his being as the phantasm of the white mind. The objectified Black is endowed with evil intentions and with all the attributes of a malefic power.” After I read this, I thought of the unarmed Black men that were gunned down by police – from the adult Mike Brown, Walter Scott, down to the young Tamir Rice. Black men of all ages and sizes inspire fear. The most impactful chapter of The Man-Not is “Eschatological Dilemmas: Anti-Black Male Death, Rape, and the Inability to Perceive Black Males Sexual Vulnerability”. Dr. Curry perfectly illustrates that throughout his time in America, the Negro has never been seen as a victim of sexual violence. Through his raging appetite to rape women and elongated member, the Black man cannot be raped. “The hyper-masculine stereotypes of Black males make it almost unfathomable for many onlookers to see Black men and boys as victims of women’s violence or rage,” Dr. Curry says. Chapter 4 also analyzes the sexualized pressure that led to many Black men being killed in the late 1800’s. Because he was a Black man and could rape, the white woman was in potential danger and these men had to be lynched. “He has to be controlled. He has to be locked away…” This way of thinking has not only been used throughout the years to falsely convict Black men of raping and sexually assaulting white women, but has forever stamped the Black man as hypersexual in his own community. While The Man-Not spends much of its time combating the negative stereotypes that reduce the Black man to a caricature, it also muses about life as a Black child seeing the violence that is directed at him because he is male. Dr. Curry writes, “Imagine what it means to see this life from the eyes of a Black boy, anxious and afraid of a youthful death – doubtful that he could live long enough to be a Black man?” This is something that every Black man living in America realizes: that he could be a victim of police terrorism, state-sanctioned murder, or even killed at the hands of a white vigilante who believes his or her life is in danger. I have written about this extensively, knowing that our life is perilous. In the land rife with anti-Black male sentiment, The Man-Not presents the case for why Black men have not only been historically a target of every type of violent attack and stereotype, but that because of their Black maleness, this eliminates any supposed privilege they would share with white men. Dr. Curry describes a world where even though Black men have the lowest employment, the lowest life expectancy, and the highest percentage of people who are incarcerated in the United States in numbers that far exceed those at the height of South African Apartheid, there is a supposed inherent advantage to being Black and male. African-American men constitute the lowest numbers of being students and instructors in college. They are also killed by police at a larger percentage than any other living group. With all this being said, they are to have male privilege and are subjects of discourse taught in universities that African-American men are pathologically oppressive and violent. This special type of vitriol is called “Black Misandry” a term Dr. Curry and his colleagues have popularized when discussing the anti-Black male thought. The Man-Not destroys this train of thought with facts and that is what makes it such a powerful book. The Man-Not is an important work that is essential in the day and age of disposable blog entries that ride on incorrect tropes about Black men. This is factual work backed up by data that can be proven, and that is what is missing in conversations about race. The Man-Not is a very dense book. There is a lot to digest here, but a book about racism and white supremacy should not be a quick read. This is a triumph in Black studies and about how the African-American man and boy is written. I felt pride and satisfaction reading this book. A Black man writing a book to humanize Black men and boys: it couldn’t have come at a better time for me and everyone else. — Thinning Hair? Apply This On Your Hair and Watch What Happens What’s your take on what you just read? Comment below or write a response and submit to us your own point of view or reaction here at the red box, below, which links to our submissions portal. ◊♦◊ Sign up for our Writing Prompts email to receive writing inspiration in your inbox twice per week. If you believe in the work we are doing here at The Good Men Project, please join us as a Premium Member, today. All Premium Members get to view The Good Men Project with NO ADS. A $50 annual membership gives you an all-access pass. You can be a part of every call, group, class, and community. A $25 annual membership gives you access to one class, one Social Interest group, and our online communities. A $12 annual membership gives you access to our Friday calls with the publisher, our online community. Subscription Amount Annual Platinum $50.00 Total Today $50.00 Total Recurring Per Year $50.00/Year Need more info? A complete list of benefits is here. Photo: Pixabay",false
"Dad Buys Used Desk For $150 On Craigslist, Then He Finds A Hidden Bag Filled With Money Inside","A Connecticut woman bought a desk from Staples, but after a few years grew tired of it. She decided to sell it to Noah Muroff and his wife for about $150 on Craigslist. There was nothing peculiar about the transaction at all. Muroff and his wife had difficulty fitting the desk into the room. They decided to take it apart to fit it in. After Noah removed the filing cabinets, he noticed a plastic bag poking out. First, he saw a $100 bill. Then he saw that inside there were stacks of them. He and his wife counted the money. There was a whopping $98,000. “If we didn’t take those drawers out, we never would have found it,” Muroff said. But he knew immediately that he couldn’t keep the money. He called the woman he bought it from. It turned out she hid her inheritance in the desk and couldn’t remember where she put it. When Muroff called her, she was speechless. “She was so shocked and touched that anyone would call,” he said. “She said, ‘You could have kept the money and nobody would have ever known.'” Muroff, who is a rabbi, and his wife believe honesty is the most important thing. “We both agreed that this is not our money,” he said. “If God wants us to have $98,000, he’ll make sure to give it to us in some other way.” The woman was so grateful, she summed up how she felt in a thank-you card. “I do not think there are too many people in this world that would have done what you did by calling me. I do like to believe that there are still good people left in this crazy world we live in. You certainly are one of them,” the woman wrote. “I cannot thank you enough for your honesty and integrity.” Please SHARE this story if you’re glad Noah Muroff did the right thing for the woman! Due to restrictions, this video cannot be viewed in your region.",false
New body cam video shows Las Vegas police encounter with Michael Bennett,"SEATTLE - The Las Vegas Metro Police Department (NVMPD) released new body camera video on Friday from its investigation into the encounter with officers and Seahawks defensive end Michael Bennett. Bennett in early September accused Las Vegas police of racially motivated excessive force, saying he was threatened at gunpoint and handcuffed following a report of gunshots at an after-hours club at a casino hotel. Michael Bennett calls police confrontation a 'traumatic experience' Michael Bennett promises to donate $25K to Harvey victims Bennett, who has recently remained seated during the national anthem prior to football games, posted a statement to Twitter detailing his side of the story. &gt;&gt; See photos here frame-by-frame from when Michael Bennett was put in the back of a police car The NVMPD first gave a news conference in early September about the accusations, saying there was no evidence Bennett was detained because of his race. On Friday, the sheriff reported no evidence of excessive force, and he showed the controversial interaction between Bennett and officers. According to the department, officers were investigating an active shooter call — which turned out to be false — and Bennett running quickly prompted a chase. The chase ended with the controversial encounter. Scroll down below to read expanded sections on what happened. Related coverage The events leading up to the encounter The Las Vegas Police Department has shared body camera video during a news conference of the scene that unfolded outside and inside the casino-hotel, The Cromwell and Drai Nightclub, leading up to the incident with Bennett on August 27. The video shows officers responding to an active shooter call, which turned out to be false. According to police, a stanchion was knocked over during a fight, which prompted reports of a shooting. As officers investigated, patrons panicked as they tried to leave the building. Video shows people screaming and scrambling to get out of the casino and others trying to hide. See video of when chaos unfolded, and scroll down to keep reading. In the body camera video, officers can be heard telling people to leave casino. Thousands of people were in the area at the time of the active shooter call, according to police. Bennett was crouched down as officers approached, and then he quickly ran, and jumped over a ledge onto busy Flamingo Boulevard. This led officers to chase him and order him to the ground, police said. Watch the video of his interaction with officers while in the back of a police car below. Scroll down to read Bennett's letter. After digging into 861 tapes, police released new body camera video on Friday that showed officers putting Bennett in the back of the police car. Bennett is panicked, asking what he did wrong, and pleading to be let go. Sheriff Joe Lombardo said the video shows some claims that Bennett made were not true, such as a gun being held to his head. Lombardo said that while officers had a gun in hand while putting Bennett in cuffs, it was not directed at his head. As for the claims officers said they would, ""blow his ******* head off,"" Lombardo reports his department found no evidence of that. What Bennett says in his letter Bennett wrote in his letter that he was visiting Las Vegas to watch the Mayweather-McGregor fight, and he was on the way to his hotel when he was detained. According to Bennett's statement, police ordered him to the ground at gunpoint, jammed a knee into his back and handcuffed him so tight that his fingers went numb. According to Bennett, one officer placed a gun near his head and warned him if he moved his would ""blow his ******* head off."" In his letter, Bennett called it an excessive use of force, simply because he was a ""black man in the wrong place at the wrong time."" Read his full letter below, and scroll down to watch video of part of the encounter. A brief video obtained by TMZ Sports surfaced just hours after the letter. It showed part of the encounter between police and Bennett, where he lay on the ground as an officer puts him in handcuffs. “I wasn’t doing nothing, man,” Bennett is heard saying in the video. “They told us to get out and everybody ran.” Bennett's attorney on the encounter Bennett's attorney, John Burris in Oakland, California, said he believed the TMZ 30-second video clip showed some of how his client was treated. ""We think there was an unlawful detention and the use of excessive force, with a gun put to his head,"" Burris told The Associated Press. ""He was just in the crowd. He doesn't drink or do drugs. He wasn't in a fight. He wasn't resisting. He did nothing more or less than anyone in the crowd."" Burris said Bennett waited to make public his account of the incident until after Burris contacted Las Vegas police last week by letter and email, seeking police records of Bennett's detention. What NVMPD say about 'bias-based policing' In addition to explaining the events leading up to the encounter, police commented on social media commentary that the detention was motivated by race. “Many of the folks ... have called this an incident of biased-based policing … police officers focused solely on the race of an individual … I can tell you as I stand here today I see no evidence of that,” said NVMPD Undersheriff Kevin McMahill. ""In fact as you may have noticed, while officers were searching the casino they were able to evacuate many patrons of all races. It’s also important for me to note to you both of the officers involved in this incident in question are of Hispanic origin,"" McMahill said. McMahill invited Bennett and his legal team to make a formal statement to the officers. According to McHill, after his detention, Bennett told officers that he understood the events that led to the incident. He did mention to police that he had an issue with the officer who held a gun to his head. In their second news conference, Lombardo commended the officers for following their training, and he called them heroic for running into a possible active shooter situation. One of the officers involved in the incident did not have his body camera activated. About Bennett as an advocate Bennett is one of the 200 NFL players who didn’t participate in the national anthem over the weekend in the wake of President Donald Trump suggesting the NFL bar players from kneeling in protest. The entire Seahawks team also didn’t participate during the anthem and sat out in the lockerroom before their game against the Tennessee Titans. Over the last year, Bennett has been a leader of the national anthem protests started by former 49ers quarterback Colin Kaepernick. Before President Trump’s comments on the NFL, Bennett gave this reason for his protesting: “I have always held the strong conviction that protesting or standing up for justice is just simply the right thing to do. This fact is unequivocally, without question, why before every game, I sit during the national anthem – because equality doesn’t live in this country, and no matter how much money you make, what job title you have or have much you give, when you are seen as a ‘n*****,' you will be treated that way."" Pete Carroll supports his players and Bennett. At a news conference on Monday, Carroll told reporters he understands why people are upset with the protests, but he hopes that they listen. ""It is not about denigration of the flag or our country,"" Carroll said. ""We all can learn what we want to learn out of this, but I hope we learn about empathy."" © 2018 Cox Media Group.",false
"Trump on Twitter (April 1): DACA, NAFTA","The following statements were posted to the verified Twitter accounts of U.S. President Donald Trump, @realDonaldTrump and @POTUS. The opinions expressed are his own. Reuters has not edited the statements or confirmed their accuracy. @realDonaldTrump : - HAPPY EASTER! [0827 EDT] - Border Patrol Agents are not allowed to properly do their job at the Border because of ridiculous liberal (Democrat) laws like Catch &amp; Release. Getting more dangerous. ""Caravans"" coming. Republicans must go to Nuclear Option to pass tough laws NOW. NO MORE DACA DEAL! [0956 EDT] - Mexico is doing very little, if not NOTHING, at stopping people from flowing into Mexico through their Southern Border, and then into the U.S. They laugh at our dumb immigration laws. They must stop the big drug and people flows, or I will stop their cash cow, NAFTA. NEED WALL! [1025 EDT] - These big flows of people are all trying to take advantage of DACA. They want in on the act! [1028 EDT] -- Source link: (http://bit.ly/2jBh4LU) (http://bit.ly/2jpEXYR) (Compiled by Bengaluru bureau)",false
Butler County Sheriff requests ICE shut down local businesses that hire illegals,"Butler County Sheriff requests ICE to shut down business that hire illegal immigrants. (WKRC) BUTLER COUNTY, Ohio (WKRC) - Butler County Sheriff Richard Jones has written a letter to President Trump, asking him to send Immigration and Customs Enforcement (ICE) to Ohio, specifically to his county. In the letter, Sheriff Jones also calls for ICE to shut down businesses that hire illegal immigrants. He asks President Trump to come to Butler County, sit down with him and work on a plan to start ""Work Place Enforcement"". Sheriff Jones says he's also tired of illegal immigrants committing crimes here, bringing in drugs and risking the health and safety of citizens ""every day that this country allows them to be here"". Sheriff Jones spoke at a Trump rally in Sharonville last July.",false
